{
  "$schema": "../schemas/pokemon.schema.json",
  "species": "Haunter",
  "baseStats": {
    "hp": 45,
    "attack": 50,
    "defense": 45,
    "speed": 95,
    "special": 115
  },
  "type1": "Ghost",
  "type2": "Poison",
  "catchRate": 90,
  "baseExp": 126,
  "growthRate": "MediumSlow",
  "initialMoves": [
    "Lick",
    "ConfuseRay",
    "NightShade",
    "None"
  ],
  "tmHmFlags": [
    32,
    0,
    152,
    209,
    10,
    106,
    2
  ],
  "pokedex": {
    "category": "GAS",
    "categoryZh": "气体宝可梦",
    "heightFeet": 5,
    "heightInches": 3,
    "weightDecipounds": 2,
    "flavorTextPages": [
      "Because of its\nability to slip\nthrough block",
      "walls, it is said\nto be from an-\nother dimension"
    ],
    "flavorTextPagesZh": [
      "能穿墙而过，据说它是来自",
      "异次元的存在。"
    ]
  },
  "evolutions": [
    {
      "method": "trade",
      "species": "Gengar",
      "minLevel": 1
    }
  ],
  "learnset": [
    {
      "level": 29,
      "moveId": "Hypnosis"
    },
    {
      "level": 38,
      "moveId": "DreamEater"
    }
  ]
}
